{
  "muif": { "version": "1.0" },
  "metaModel": {
    "id": "urn:mu:mm:test",
    "csn": "test.model",
    "version": "1.0.0",
    "fingerprint": "sha256:c827b9f73a6e7d04177f19e3c465da98260eb10d76f985349f165611b3bbdd83"
  },
  "namespaces": ["test"],
  "objects": [
    {
      "muifType": "Object",
      "id": "test:A",
      "csn": "test.a",
      "kind": "Entity",
      "namespace": "test",
      "provenance": { "owner": "urn:mu:universe:test" },
      "properties": [
        { "name": "test.label", "valueType": "string", "required": true }
      ]
    }
  ],
  "conformance": { "muc": "2.0: Conformant", "mmas": "A1" }
}
